question,answer
申請履約爭議調解之方式？,"一、依採購履約爭議調解規則第6條規定，申請調解應具申請書，繕具履約雙方當事人之基本資料、欲請求之調解標的、事實及理由，並檢附契約及相關證據後，提送臺中市政府採購申訴審議委員會正本1份、繕本3份，並按他造人數分送副本。
二、調解申請書相關書表格式，得至「臺中市政府法制局全球資訊網-機關業務-採購申訴及履約爭議-履約爭議調解書表格式」項下下載利用。"
調解結果大致有幾類？調解不成立得否向調解委員會聲請證明文件？,"1.調解結果可分為調解成立與調解不成立兩類。依鄉鎮市調解條例第26、27條，調解成立經法院核定後，當事人就該事件不得再行起訴、告訴或自訴，且與民事確定判決有同一之效力；經法院核定之刑事調解，以給付金錢或其他代替物或有價證券之一定數量為標的者，其調解書得為執行名義。
2.依同法第30條，調解不成立者，當事人得向調解委員會聲請調解不成立證明書；調解委員會應於聲請後7日內發給。"
調解書可否不填個人資料(如住居所)？,依鄉鎮市調解條例第25條第1項第1款規定，調解成立時，調解委員會應作成調解書，記載當事人或其法定代理人之姓名、性別、年齡、職業、住、居所。另依鄉鎮市調解條例第27條第2項規定，經法院核定之民事調解，與民事確定判決有同一之效力；經法院核定之刑事調解，以給付金錢或其他代替物或有價證券之一定數量為標的者，其調解書得為執行名義。因經法院核定之調解書與確定判決有同一效力，且得為執行名義，故依法調解書上須載明調解當事人之個人資料，法院始得確認人別，如未記載，法院將不予核定。
何種事件可以向鄉鎮市區調解委員會聲請調解？,"1.依「鄉鎮市調解條例」第1條規定，鄉、鎮、市公所應設調解委員會，辦理下列調解事件：一、民事事件。二、告訴乃論之刑事事件。
2.民事事件例如債權債務之清償、房地產買賣、租賃、侵占、婚姻、繼承、公害賠償、商事買賣、其他有關民事事件。
3.告訴乃論的刑事事件如妨害風化、普通傷害、妨害名譽信用及秘密、親屬間財產犯罪、交通事故等。凡刑事案件如有侵權行為而有民事賠償請求權存在者，該民事賠償部分即屬民事事件，可由調解委員會就該民事賠償部分進行調解，與該案刑事部分是否屬告訴乃論之罪無涉（法務部107年7月6日法律字第 10703509940 號函）。"
聲請調解之方式為何？,"1.書面聲請：當事人向調解委員會索取聲請書自行填妥後提出聲請（鄉鎮市調解條例第10條第1項前段）。
2.言詞聲請：當事人以言詞向調解委員會提出聲請，經該會作成筆錄（鄉鎮市調解條例第10條第1項中段）。
3.當事人提出書面聲請者，應按他造人數提出繕本，即依對造人數提供聲請書的影本（鄉鎮市調解條例第10條第1項後段）。
4.聲請調解，應在聲請書中表明聲請調解的事由及爭議的情形；如果已經在法院辯論終結的案件，不得聲請調解（鄉鎮市調解條例第10條第2、3項）。"
聲請調解是否須經爭議事件之他方同意？,鄉鎮市調解條例第11條規定，聲請調解，民事事件應得當事人之同意；告訴乃論之刑事事件應得被害人之同意，始得進行調解。係因調解不具有強制性，調解委員決定調解期日，合法通知當事人或其代理人到場，並無拘束力，當事人無正當理由不到場，除認為有成立調解之望者，得另定調解期日外，視為調解不成立（法務部93年10月26日法律決字第0930036977號書函參照）。
應向何單位聲請調解？,"1.依「鄉鎮市調解條例」第13條，聲請調解事件之管轄如下：
一、兩造均在同一鄉、鎮、市居住者，由該鄉、鎮、市調解委員會調解。
二、兩造不在同一鄉、鎮、市居住者，民事事件由他造住、居所、營業所、事務所所在地，刑事事件由他造住、居所所在地或犯罪地之鄉、鎮、市調解委員會調解。
三、經兩造同意，並經接受聲請之鄉、鎮、市調解委員會同意者，得由該鄉、鎮、市調解委員會調解，不受前二款之限制。
2 .交通事故調解案件宜由當事人向警察機關申請相對人個人資料，俟警察機關確認肇事逃逸車輛並提供該肇逃者個人資料後，當事人再依據相關資料向調解機關聲請調解，調解機關即可據以依上開規定判斷調解案件管轄權之歸屬（法務部102年3月8日法律字第10200019250號函）。
3.本市各區調解委員會申請調解，可採線上方式申請（https://taichungmd.taichung.gov.tw/mediation.aspx）"
如何聲請債務、繼承、房屋漏水、車禍等糾紛之調解？,"1.依鄉鎮市調解條例第13、14條管轄規定，向對造住居所之區公所調解委員會聲請，繼承事件倘繼承人有數位，且住居所不在同一鄉鎮市區者，可得全部繼承人同意向其中一人之住居所調解委員會提出聲請。
2.填寫調解聲請書。
3.依聲請調解事件，分別提出「借據或票據」、「被繼承人除戶謄本、遺產清冊及全部繼承人戶籍謄本」、「建物權狀影本、漏水管線位置圖或照片、漏水施工估價單」、「交通事故鑑定報告、醫療費用收據、醫療診斷證明書影本」等各項證明文件。"
經法院核定之民事調解如有無效或得撤銷的原因，如何救濟？,法務部法律事務司98年6月25日法律決字第0980024001號函釋，經法院核定之調解案件，除兩造當事人均同意解除外，不得因單方申請而逕行撤銷調解成立案或不送法院審核；但如有意思瑕疵等情事，當事人仍得於法院核定後另依鄉鎮市調解條例第29條等規定提起調解無效或撤銷調解之訴。
告訴乃論之刑事事件由有告訴權人聲請調解，倘經調解不成立時，是否會影響刑事告訴之時效？,"1.按109年11月12日最高法院109年度台上字第4249號判決摘要：「鄉鎮市調解條例第 31 條規定：「告訴乃論之刑事事件由有告訴權之人聲請調解者，經調解不成立時，鄉、鎮、市公所依其向調解委員會提出之聲請，將調解事件移請該管檢察官偵查，並視為於聲請調解時已經告訴。」其立法目的乃為促使當事人善用鄉鎮市調解制度，使告訴乃論之罪之告訴權人，不致因聲請調解程序費時，造成調解不成立時，告訴權因告訴期間屆滿而喪失，以致影響其權益。而前揭法條既未規定有告訴權之人必須在調解不成立之「同時」聲請移請檢察官偵查，亦未對該聲請設有期間之限制。如認調解不成立之次日或其後6個月內（參照刑事訴訟法第237條規定之法理）向調解委員會提出聲請移請檢察官偵查，仍然無法視為於聲請調解時已經告訴，不免過苛，已然剝奪被害人告訴權之行使。因此，凡聲請調解不成立者，無論同時或其後6個月內向調解委員會聲請將調解事件移請該管檢察官偵查，均生視為於聲請調解時已經告訴之效果，俾符保障聲請調解之被害人猶能充分行使告訴權之立法本旨。至於為避免追訴與否懸而未定，無限聽其不安定狀態之繼續，前開向調解委員會聲請移請檢察官偵查之時間，是否宜有期間限制？以多久為適宜？尚非審判機關所能決定，有待循立法途徑解決。」
2.另109年11月25日臺灣高等法院暨所屬法院109年法律座談會刑事類提案第23號決議：「鄉鎮市調解條例第31條規定：「告訴乃論之刑事事件由有告訴權之人聲請調解者，經調解不成立時，鄉、鎮、市公所依其向調解委員會提出之聲請，將調解事件移請該管檢察官偵查，並視為於聲請調解時已經告訴。」其立法目的，乃為促使當事人重視鄉鎮市調解制度，樂於聲請調解，使告訴乃論之罪之告訴權人，不致因聲請調解程序費時，造成調解不成立時，告訴權因告訴期間屆滿而喪失，以致影響其權益。而告訴權人聲請調解不成立後，該告訴權人聲請調解委員會將調解事件移請檢察官偵查之期間並無限制，徵諸上開規定94年5月3日修正理由謂：「依刑事訴訟法之規定，限於有告訴權人之告訴始發生告訴之效果，是本條應限於有告訴權人之聲請調解始得視為於聲請調解時已經告訴，爰配合將『被害人』修正為『有告訴權之人』，以資明確。」可見立法者有意將「聲請調解」與「提出告訴」等視，兩者差別僅在於調解委員會並非偵查機關，從而只要調解不成立後，聲請調解之告訴權人聲請調解委員會將調解事件移請檢察官偵查，即視為於聲請調解時已經告訴，縱然此有無限期延長告訴期間之疑慮，但事涉告訴權人訴訟權之限制，應循修法途徑處理。
3.依上述法院實務見解，甲於民國108年1月1日因駕車過失致乙受傷，乙於 108年4月1日向丙鎮公所調解委員會聲請調解，於108年8月1日調解不成立。乙於109年3月1日聲請丙鎮公所調解委員會將調解事件移請檢察官偵查，檢察官於109年5月1日起訴甲涉犯過失傷害罪嫌，依鄉鎮市調解條例第31條規定，自應視為乙於108年4月1日聲請調解時已經告訴，其告訴合法，檢察官起訴之訴追條件並無欠缺，法院應為實體判決。"
在法院審理中的民事事件、在檢察署偵查中或法院審理中的刑事案件是否可以聲請調解？,鄉鎮市調解條例第10條第3項：第一條所定得調解事件已在第一審法院辯論終結者，不得聲請調解。至同法第1條所定得調解之民事、刑事事件有哪些，請參照「何種事件可以向鄉鎮市區調解委員會聲請調解」。
民眾聲請調解或法院移付調解後，調解委員會幾天內會通知當事人到場調解？,依「鄉鎮市調解條例」第15條第3項，第一項調解期日，應自受理聲請或移付之日起，不得逾15日。但當事人聲請延期者，得延長10日。
經鄉鎮市區調解委員會之調解成立案件其效力為何？刑事調解書經法院核定後，當事人就該事件是否可以再提起告訴或自訴？,"1.依「鄉鎮市調解條例」第27條規定，調解經法院核定後，當事人就該事件不得再行起訴、告訴或自訴。經法院核定之民事調解，與民事確定判決有同一之效力；經法院核定之刑事調解，以給付金錢或其他代替物或有價證券之一定數量為標的者，其調解書得為執行名義。
2.法務部108年9月4日法律字第10803513310號函：鄉鎮市調解條例第27 條第 1項、第28 條第2項規定參照，「不得告訴」應亦包含當事人尚未提起告訴之調解事件，又目前部分法院於審核調解書時，鑑於刑事告訴權不得預先捨棄，建議將調解書內容記載使用較無爭議文字；另上述規定係為使紛爭得以終局解決，避免調解經核定後再生爭端，倘調解書中以附帶條件方式撤回告訴，因條件是否成就未能確定，從而將影響調解內容之明確性與安定性，調解書中以附帶條件方式撤回告訴，恐遭法院不予核定。"
民眾間發生爭議時，利用鄉鎮市區調解委員會調解究竟有何好處？,"1.聲請調解之程序簡單、調解流程進行迅速。
2.依「鄉鎮市調解條例」第23條規定，除勘驗費應由當事人核實支付外，不徵收任何費用或報酬，或以任何名義收受報酬。
3.調解之開始、進行、終結均尊重當事人的意思（鄉鎮市調解條例第10、11、13、17、20條）。
4.依「鄉鎮市調解條例」第27條第2項規定，調解成立，送經法院核定後，與法院確定判決有同一效力。"
民眾發生紛爭，除到法院訴訟外，是否還有其他解決途徑？,民眾發生民事或告訴乃論刑事案件紛爭時，除了向法院提起訴訟外，還可以依照「鄉鎮市調解條例」第10條第1項之規定，由當事人向調解委員會以書面或言詞聲請調解；以言詞提出聲請者，應製作筆錄；以書面提出聲請者，應按他造人數提出繕本。
甲夫與乙妻於107年12月底間參加台中市府舉辦之跨年晚會認識，兩人相見恨晚，於108年2月閃電結婚並定居於臺中市，並於109年1月誕下一子丙男，但是好景不長，甲夫從事餐飲業，受新冠肺炎影響，甲在家放無薪假，頓時少了每月7萬元收入，乙妻則從事保母業，每月收入2萬餘元，因為收入減少，又要扶養幼子，導致甲夫與乙妻爭執不斷，雙方感情破裂，在109年10月10日雙方協議離婚，丙子親權歸乙女所有，乙女與丙子則搬到苗栗定居，甲、乙雙方於離婚協議書上載明：「雙方拋棄剩餘財產分配請求權，未來兩人財產各不相干，丙子由乙女負責扶養成人，日後絕不向甲男有任何請求。」未料乙女因某次疏忽未能將其照顧之丁男嬰照顧妥當，於是被雇主解雇導致失業，乙女坐吃山空，在存款即將用盡之時，想起了前夫甲男，乙女想以其名義具狀向法院提出請求扶養費之訴訟，但是又想起曾與前夫甲簽署之離婚協議書之約定，乙女驚覺不妙，內心覺得忐忑不安，不知如何是好？請問可否建議乙女採取何種方式取得扶養費？本案起訴前是否需先經過調解程序？如乙女最終想以訴訟為之，其受訴法院為何？可否由甲、乙協議至台中地方法院處理？ ,"一、乙女仍可向甲男請求未成年人丙子之扶養費依民法第1084條第2項之規定：「父母對於未成年之子女，有保護及教養之權利義務。」所謂保護及教養之權利義務，自包括「扶養」在內(最高法院107年台簡抗字第148號裁定)。又父母對於未成年子女之扶養義務，不因結婚經撤銷或離婚而受影響，民法第1116條之2定有明文。因此，即便乙女與甲男於離婚時協議，乙女日後絕不向甲男請求丙子之扶養費，但此不過為二人之「內部」約定而已，該約定對於未成年人丙子不生效力(最高法院98年台上字第1536號判決)，故乙女仍可本於丙子之名義，以法定代理人之身分向甲男請求扶養費(民法第1086條第1項參照)。
二、本案起訴前應經調解程序本案中，關於乙女代理未成年子女丙向甲男請求扶養費之事件，其定性為家事事件法第3條第5項第8款「定對於未成年子女權利義務之行使負擔事件」之戊類事件(最高法院102年台簡抗字第29號裁定、最高法院102年台抗字第339號裁定)。又「家事事件除第三條所定丁類事件外，於請求法院裁判前，應經法院調解」，家事事件法第23條第1項定有明文。因此，乙女在起訴前，依照上述規定，欲就戊類事件請求法院裁判之前，應經法院為調解程序，如乙女逕向法院請求裁判者，則視為調解之聲請(家事事件法第23條第2項本文參照)。
三、乙女如欲以訴訟為之，其受訴法院專屬為未成年丙子之住所地法院管轄，不可由甲、乙協議至台中地方法院處理由上述可知，關於乙女代理未成年子女丙向甲男請求扶養費之事件，屬於戊類之家事非訟事件，又依照家事事件法第104條第1項第1款之規定，關於未成年子女扶養之請求，專屬子女住所或居所地法院管轄，其立法目的為，關於上述之非訟事件，多發生在子女身分關係生活之中心即住居所地，為便利未成年人使用法院及調查證據之便捷，以追求實體及程序利益，宜以其住所或居所地法院專屬管轄。依此，丙子之住所地為苗栗，依上述規定，乙女如欲以訴訟為之，係以苗栗地方法院為「專屬」管轄，甲、乙「似」不可協議至台中地方法院處理。惟依家事事件法第6條第1項本文：「法院受理家事事件之全部或一部不屬其管轄者，除當事人有管轄之合意外，應依聲請或依職權以裁定移送於其管轄法院。」可知，不同於民事訴訟法，家事事件法中的「合意」管轄，其效力優先於「專屬」管轄(家事事件法第6條立法理由參照)，因此甲、乙仍可協議之台中地方法院處理，不受家事事件法第104條第1項專屬管轄之拘束。"
某甲為房屋仲介，每月銷售房屋可賺取佣金金額至少在50萬以上，每月生活開銷結餘約20萬，但是因妻子早年亡逝，結交多數酒店女友，開銷頗大，膝下育有4子，其中長男、次男、三男均國立大學研究所畢業，事業有成，但四子雖已成年，年紀輕輕不學好，結交壞朋友，甚至沾染毒品，某甲非常氣憤，某甲於109年11月16日，改邪歸正，決心不再流連酒店，此時名下財產，均為現金，總計有320萬元，甲心血來潮，寫了自書遺囑，將財產320萬元，分給長男、次男、三男各一百萬，因四子非常不受教，非常不開心，打算只給他20萬，甲寫完自書遺囑，想請民間公證人為他公證遺囑，以免死後四個小孩為遺產爭吵，請問民間公證人可以幫某甲做遺囑公證嗎？甲之遺囑有什麼問題？,"一、甲的自書遺囑符合自書遺囑的規定依民法第1189條，遺囑的方式只有「自書遺囑」、「公證遺囑」、「密封遺囑」、「代筆遺囑」、「口授遺囑」等五種方式，創設上述方式以外的遺囑，無效！所以不可不慎。本案中，甲是以「自書遺囑」的方式完成遺囑，因此須嚴格遵守民法第1190條的規定，而自書遺囑須遵守：(一)自書遺囑全文(即「手寫」，不可電腦繕打，參照最高法院102年台上字第900號裁定)、(二)記明年、月、日、(三)親自簽名。如果有一個地方未遵守，遺囑即無效！而甲的自書遺囑均符合上述自書遺囑的規定。
二、如果甲死亡時之遺產為320萬，則甲的自書遺囑已經侵害四子的特留分，但遺囑不會因為這樣而無效喔依民法第1187條，只要遺囑人在不違反特留分的範圍內，得以遺囑自由處分其遺產，本案中，甲的繼承人有4人，均為其直系血親卑親屬，應繼分為遺產的各四分之一(即各80萬)，而各自特留分為應繼分的二分之一(即各40萬)。然而，甲只願意給四子20萬，已侵害四子的特留分！則該遺囑是否會因違反特留分而無效呢？實務認為(最高法院81年台上字第1042號判決)，遺囑如果侵害特留分，則被侵害人得行使民法第1225條之「扣減權」，一旦行使，侵害特留分的部分，即失其效力。由此可知，侵害特留分的遺囑，仍有效，只是被侵害人(即本案的四子)得行使扣減權而已。
三、民間公證人仍得幫甲的遺囑公證，但應盡「特留分規定」之說明義務依上述，甲的自書遺囑有效，但甲如果害怕其死亡後，其繼承人會爭執遺囑之真偽而產生紛爭，因此甲可持該遺囑向公證人請求公證，以增加遺囑真偽、內容之信度。而公證人在面臨可能侵害特留分之遺囑，可否公證呢？對此，過往有公證人可能會主張其不得就違反法令(本案為可能違反特留分之情形，蓋是否違反特留分，應以甲死亡時之遺產數額為準，非甲目前之財產數額)事項作成公證書而拒絕公證(公證法第70條)，但公證法施行細則第71條訂定後，其規定內容為，公證人應向遺囑人說明民法關於特留分之規定，並且應於公證書記載該說明及當事人就此所為之表示，必要時並得註明：「於繼承開始時，其遺囑內容如有違反特留分之規定者，相關繼承人得依法扣減之」。由此可知，民間公證人仍得就該遺囑公證，只是須遵守上述公證法施行細則第71條規定而已。"
某甲現年50歲與某乙結婚經商有成多年，卻膝下無子，某甲與某丙、丁夫妻為國小同鄉同學感情甚篤，而某丙、丁夫妻育有二子一女，次子阿成剛滿一歲，某甲夫妻時常與丙夫妻相聚，並對阿成素有好感，新冠疫情爆發，致擔任導遊的某丙、丁夫妻失業，苦無收入，只能以工代賑短期在政府部門領取微薄薪水，但是三個小孩開支頗大，而某甲與某乙欲收養阿成，以減輕好友某丙的經濟壓力而丙、丁夫妻均有意願出養阿成。請問甲、乙夫妻是否可以直接收養阿成？(甲乙與阿成無任何血緣、姻親關係),"甲、乙夫妻是否可以收養阿成，必須要看是否同時符合以下二法律之規定：
一、兒童及少年福利與權益保障法(下稱「兒少法」)的規定兒少法第16條規定，如果本生父母丙、丁想要將「兒童」阿成(阿成為兒少法規定的「兒童」)出養的話，原則上應委託收出養媒合服務者代覓適當的收養人。但例外於下列情形之出養，則不須委託收出養媒合服務者代覓適當的收養人：(一)旁系血親在六親等以內及旁系姻親在五親等以內，輩分相當、(二)夫妻之一方收養他方子女。由於甲、乙並未符合上述兒少法的例外情形，亦即，甲乙與阿成無任何血緣、姻親關係，因此不可任意的直接收養阿成。丙、丁仍應委託收出養媒合服務者代覓適當的收養人。
二、民法的規定接續上述，若收出養媒合服務者代覓適當的收養人為甲、乙夫妻的話(這裡要說的是，在實務上，甲、乙不一定會成為收出養媒合服務者代覓之適當收養人喔，收出養媒合機構會視個案情形選出適當之收養人)，則仍須向法院為收養認可之聲請，法院在認可與否之審查時，除須審查收養是否符合未成年子女阿成之最佳利益外，尚須符合民法關於收養的規定，而民法關於收養未成年子女的規定，大致有：(一)收養人與被收養人年齡差距的規定(民法第1073條)。(二)收養人與被收養人不可有一定親屬關係的規定(民法第1073條之1)。(三)如被收養人未滿七歲，須由被收養人之本生父母代為並代受意思表示的規定(民法第1076條之2第1項)。
甲、乙夫妻與被收養人阿成與阿成之本生父母丙、丁均符合以上民法的規定，並無疑問。若甲、乙夫妻收養阿成係符合阿成的最佳利益，則甲、乙夫妻得收養阿成。法院會下認可收養的裁定。"
義務人收到本府各機關開立之裁處書應如何繳納罰鍰？,"一、本府民政局等19個機關之行政罰鍰案件，依照罰鍰金額的大小，可分別透過不同管道繳納罰鍰更便利，分別如下：（一）繳納罰鍰金額2萬元以下，可利用多元管道繳費機制，持繳費單就近至7-11、全家、萊爾富及OK便利商店等各大超商繳納。（二）繳納罰鍰金額2萬元以上，則可以透過ATM自動櫃員機或至臺灣銀行、農會及郵局或全國繳費網等代收機構繳納罰鍰。（三）行政罰鍰案件多元管道繳納方式說明網址：https://aesearch.taichung.gov.tw/tbrf_opendata/multiple.jsp以上可利用「行政罰鍰案件多元管道繳納機制」之機關計有：法制局、民政局、財政局、教育局、經濟發展局、建設局、交通局、都市發展局、水利局、農業局、觀光旅遊局、社會局、勞工局、消防局、衛生局、文化局、地政局、新聞局、原住民族事務委員會等19個機關。
 
二、另外，自105年12月15日起，除文化局及原住民族事務委員會外，其餘16個機關均可透過下列2種方式進行線上繳費：（一）晶片金融卡轉帳：需自備讀卡機，每筆交易手續費金額為15元。（詳細說明及注意事項）（二）信用卡繳費：手續費依各發卡銀行而定。（詳細說明及注意事項）"
