question,answer
"4歲的小乖正值懵懵懂懂、需要大人指導與教育的年紀，但小乖的父母因為工作無法陪伴在小乖身邊，只好將小乖托給同住的阿姨照顧。小乖阿姨因為年歲較長，無法管束活潑好動的小乖，如果小乖調皮、不聽話，阿姨便大聲辱罵小乖、不讓小乖吃飯，甚至將小乖關在封閉又黑暗的廁所裡，要小乖「自我反省」。長期以來，小乖內心充滿恐懼感，變得很容易不安與焦躁，也有營養不良的現象，小乖父母返家後發現小乖的異狀，趕緊將小乖送往醫院治療。
","一、家庭暴力防治法相關規定：（一）第2條規定：「本法用詞定義如下：一、家庭暴力：指家庭成員間實施身體、精神或經濟上之騷擾、控制、脅迫或其他不法侵害之行為。……六、加害人處遇計畫：指對於加害人實施之認知教育輔導、親職教育輔導、心理輔導、精神治療、戒癮治療或其他輔導、治療。」（二）第3條規定：「本法所定家庭成員，包括下列各員及其未成年子女：一、配偶或前配偶。二、現有或曾有同居關係、家長家屬或家屬間關係者。三、現為或曾為直系血親或直系姻親。四、現為或曾為四親等以內之旁系血親或旁系姻親。」（三）第50條規定：「（第1項）醫事人員、社會工作人員、教育人員、保育人員、警察人員、移民業務人員及其他執行家庭暴力防治人員，在執行職務時知有疑似家庭暴力，應立即通報當地主管機關，至遲不得逾24小時。……」
二、為防治家庭暴力行為及保護被害人權益，我國於87年制定「家庭暴力防治法」，更是亞洲第一部規範家庭暴力行為的法律！打破傳統「法不入家門」的觀念，家庭暴力防治法明確規範家庭暴力行為，更引進保護令制度、建立加害人輔導與治療制度，強化預防與治療並重之防治工作。
三、小乖父母因工作關係，無法親自陪伴小乖成長，將小乖交由同住阿姨照顧，小乖阿姨即屬家庭暴力防治法所稱之家庭成員；而家庭暴力防治法所稱家庭暴力行為更不限於身體上的傷害行為，也包括精神暴力、經濟暴力等行為。本案中，小乖阿姨過當管教行為，雖然未必構成刑事法所稱傷害罪，但已屬於家庭暴力防治法所稱家庭暴力行為，小乖阿姨如有違反相關規定時，相關司法及行政機關即可介入防範或管制；家庭暴力行為不應該被姑息、縱容，當自己或身邊有人遭受虐待時，一定要選擇求援，尋求立即的幫助，才是保護自己，也保護家人的最好方法。"
"年滿18歲的高三生小呆很喜歡扭蛋玩偶，每次下課後都會到附近商家去投幣轉扭蛋，但長期下來也花掉了小呆不少存款；某天，小呆發現遊樂場代幣跟10元硬幣形狀、大小、重量等都很相似，他心想或許可以騙過扭蛋機，便試著投幣轉扭蛋，沒想到扭蛋機果然無法辨識，當場就讓小呆轉到不少扭蛋，他也心滿意足的抱著這些免費的扭蛋回家！商家老闆在盤點扭蛋機器硬幣時發現夾雜遊樂場代幣，立刻報警處理，調閱監視器後發現是小呆所為，請問小呆此舉是否有法律上責任？
","一、刑法第339條之1規定：「（第1項）意圖為自己或第三人不法之所有，以不正方法由收費設備取得他人之物者，處1年以下有期徒刑、拘役或10萬元以下罰金。（第2項）以前項方法得財產上不法之利益或使第三人得之者，亦同。（第3項）前二項之未遂犯罰之。」，不正利用收費設備詐欺罪係因目前社會自動付款或收費設備之應用，日益普遍，如以不正方法由此種設備取得他人之物或得財產上不法利益，不只有損業者權益，而且破壞社會秩序；本條所稱「不正方法」泛指一切不正當方法而言，並不以施用詐術為限，任何意圖規避給付對價，而以不合設備所定使用規則，操縱該設備取得他人之物或財產上不法利益，例如使用偽幣免費取得自動售物機內之物品、使用偽造儲值卡扣減儲值而免費取得物品或服務等。
二、小呆明知應以10元硬幣投入扭蛋機（收費設備），才能合法取得扭蛋，卻以遊樂場代幣偽冒10元硬幣欺騙扭蛋機，讓機器誤以為代幣為10元硬幣而售出扭蛋，然扭蛋係屬商家老闆所有之財物，依上開刑法規定，小呆是利用不正方法由收費設備取得他人之物，其已經觸犯不正利用收費設備罪。
三、綜上，免費的扭蛋卻換來的最昂貴的代價，而小呆一時貪小失大的行為，讓他最愛的扭蛋不再充滿解憂的樂趣，不可不慎！"
"年滿18歲的高三學生阿雄富有正義感，看到不平之事常常仗義執言；某天阿雄看到同班同學阿凱躲在角落抽煙，便向前制止，沒想到阿凱惱羞成怒，開始對阿雄拳打腳踢更造成阿雄因此全身瘀青；傷癒後的阿雄開始悶悶不樂，更開始害怕上學。請問阿凱此舉是否有法律上責任？
","一、刑法第277條第1項規定：「傷害人之身體或健康者，處5年以下有期徒刑、拘役或50萬元以下罰金。」，傷害罪所要保護的是個人身體或健康法益，避免受到不法侵害；另外依刑法第287條規定，普通傷害罪屬於告訴乃論之罪，也就是說，普通傷害罪之成立必須以被害人（或其他具有告訴權之人）提起告訴為前提。
二、民法第184條規定：「（第1項）因故意或過失，不法侵害他人之權利者，負損害賠償責任。（第2項）故意以背於善良風俗之方法，加損害於他人者亦同。違反保護他人之法律，致生損害於他人者，負賠償責任。但能證明其行為無過失者，不在此限。」、第193條第1項規定：「不法侵害他人之身體或健康者，對於被害人因此喪失或減少勞動能力或增加生活上之需要時，應負損害賠償責任。」及第195條第1項規定：「不法侵害他人之身體、健康、名譽、自由、信用、隱私、貞操，或不法侵害其他人格法益而情節重大者，被害人雖非財產上之損害，亦得請求賠償相當之金額。其名譽被侵害者，並得請求回復名譽之適當處分。」，個人之身體或健康受到他人不法侵害時，得請求加害人應負損害賠償責任，賠償範圍除因此所受損害、所失利益外，更包括受害人因此喪失勞動能力所受損害、增加生活需要之支出及非財產上之損害等。
三、綜上，阿凱違反校園規定抽煙，阿雄基於好意勸諫阿凱不要抽煙，阿凱卻惱羞成怒，故意將阿雄毆打成傷，阿雄除了可以向阿凱提起普通傷害罪之告訴外，也可以向阿凱請求賠償其身體健康受損之財產損害及非財產損害；阿凱衝動的行為讓阿雄身心都受到不小的打擊與傷害，而相對地阿凱也要承擔相關刑事及民事責任，一個衝動的行為卻讓兩人青春歲月都印上黑青色的記憶。"
"年滿20歲的大三學生花花因不滿同學美美在班上人緣極佳，因一時嫉妒，竟當著全班同學面前捏造並嘲諷美美腦袋不好，是白癡笨蛋等語，讓美美覺得非常難過，請問花花此舉是否有法律上責任？
","一、刑法第309條第1項規定：「公然侮辱人者，處拘役或9千元以下罰金」，公然侮辱罪所要保護的是個人經營社會群體生活的人格評價，避免受到不當詆毀，而減損或貶抑被害人之人格或地位評價，所以，在不特定人可以聞見之公共場合，用粗鄙語言向特定之人為辱罵，且該語言含義又足以減損該特定人聲譽時，可能構成刑法之公然侮辱罪；另外依刑法第314條規定，公然侮辱罪屬於告訴乃論之罪，也就是說，公然侮辱罪之成立必須以被害人（或其他具有告訴權之人）提起告訴為前提。
二、民法第195條第1項規定：「不法侵害他人之身體、健康、名譽、自由、信用、隱私、貞操，或不法侵害其他人格法益而情節重大者，被害人雖非財產上之損害，亦得請求賠償相當之金額。其名譽被侵害者，並得請求回復名譽之適當處分。」，為保護名譽不法侵害之人，其得向加害人請求賠償關於非財產上之損害；但加害人之賠償責任仍應以相當之金額為限，也就是賠償金額必須衡量個案實際加害情形與名譽影響是否重大，及被害者之身分地位與加害人經濟狀況等關係綜合決定之。
三、綜上，花花明知美美並無腦袋不好的情形，居然在全班同學面前侮辱美美，造成同學對於美美的評價降低，使美美名譽受到損害，美美除了可以向花花提起公然侮辱罪之告訴外，也可以向花花請求賠償名譽受損之相當金額；而花花因為一時衝動，禍從口出，使美美內心留下深刻的傷害，更可能負擔刑事及民事賠償責任，真的是得不償失！"
"剛剛年滿18歲大學一年級新生小明想要購買一台昂貴跑車，並與業者簽訂跑車買賣契約，是否有效。
","一、為使民法成年之定義與刑事責任及行政罰責任之完全責任年齡相符（刑法第18條、行政罰法第9條均規定為18歲），另考量現今社會網路科技發達、大眾傳播媒體普及、資訊大量流通，青年之身心發展及建構自我意識之能力已不同以往，且世界多數國家關於成年年齡規定多為18歲，為使民法成年定義符合社會青年身心發展現況，保障其權益，並與國際接軌，我國於110年1月13日修正關於民法成年之定義，並明定於112年1月1日施行。
二、民法關於成年定義修正之相關規定，簡述如下：（一）民法修正後，成年年齡將由原先20歲，修正為18歲。（二）關於未成年人結婚及訂婚年齡之限制，不再因性別而有不同；最低結婚年齡均為18歲，最低訂婚年齡均為17歲，並刪除未成年人因結婚而取得行為能力及相關規定。（三）綜上，民法修正施行後，滿18歲之人即為成年人，亦即有完全行為能力，相對地，也必須負擔各項法律行為責任。
三、舉例而言，剛剛年滿18歲大學一年級新生小明想要購買一台昂貴跑車，並與業者簽訂之買賣契約，是否有效？
（一）依現行有效民法第12條及第13條規定，小明為限制行為能力人（7歲以上但未滿20歲），並不具有完全行為能力；因此，小明縱與業者簽訂跑車買賣契約，在法定代理人（如父母）同意該買賣契約前，這份契約並不會因為小明已經簽名而發生效力。（二）但在112年1月1日以後，依修正後民法第12條規定，小明為成年人（年滿18歲）並具有完全行為能力；因此，小明可以單獨決定簽訂跑車買賣契約，不需得到法定代理人同意，該份契約已發生法律上效力。（三）民法修正並於112年1月1日施行後，年滿18歲青年將成為法律上之成年人，可以單獨決定是否簽訂契約，甚至決定是否結婚，不再如過去需要法定代理人同意，才會發生法律上的效力。溫馨提醒父母及孩子們注意這項規定的修正，才能一起迎接更美好的成年生活！"
"小明某日於KTV飲酒歡唱後，搭乘小華駕駛其所有之計程車返家，途中因酒醉在車上嘔吐，致嘔吐物佈滿計程車後座區及右後門。則小明有何法律責任？
","一、關於刑事法律責任：
刑法第354條：「毀棄、損壞前二條以外之他人之物，或致令不堪用，足以生損害於公眾或他人者，處二年以下有期徒刑、拘役或五百元以下罰金。」係屬普通毀損罪之規定。而本罪之「致令不堪用」係指以毀棄、損壞以外之其他方法，雖未毀損原物，但已喪失物之「功能效用」而言。本案中，車上之嘔吐物經清洗即可，並未致車輛不堪使用，因此尚難對小明以毀損罪處罰之。
二、關於民事法律責任：
(一)小明嘔吐的行為對小華成立侵權行為民法第184條第1項：「因故意或過失，不法侵害他人之權利者，負損害賠償責任。故意以背於善良風俗之方法，加損害於他人者亦同。」此條文為侵權行為之規定。本案中，小明因酒醉在小華所有之計程車上嘔吐，造成小華之車輛髒污，小華因此受有財產損害，小明已構成侵權行為。
(二)小明須對小華負以下損害賠償責任按「負損害賠償責任者，除法律另有規定或契約另有訂定外，應回復他方損害發生前之原狀。」、「第一項情形，債權人得請求支付回復原狀所必要之費用，以取代回復原狀。」。「損害賠償，除法律另有規定或契約另有約定外，應以填補債權人所受損害及所失利益為限。」民法第213條第1項、第3項及第216條第1項分別定有明文。因此，小華可依民法第213條第1項、第3項之規定，要求小明回復原狀(即髒污之清潔)，或可直接向小明請求車輛清潔費用之損害賠償(即直接請求清潔之必要費用)。另外，小華之計程車如因嘔吐穢物臭味久久未能散去致無法正常營業所造成的損失，另可依民法第216條第1項向小明請求賠償營業損失。"
"小莉某日帶著所飼養的小型寵物狗至公園遛狗，驚見一隻大型比特犬從遠處衝來，將她所養的小狗拖在地板上狠咬，導致其愛犬背部被咬出5個傷口，小莉緊急將愛犬送至動物醫院救治，花費10,000元醫療費用。事件發生後，闖禍的男飼小明竟還冷回「我家的狗平時很乖，一定是被妳的狗挑釁才會失控」，令小莉感到十分憤怒便將經過PO上網，小莉並認為該比特犬的飼主小明應該接受處罰，並賠償愛犬10,000元的醫藥支出，法規依據為何？ ","一、違反動物保護法之行政責任： 依動物保護法(下稱「動保法」)第20條規定，具攻擊性之寵物出入公共場所或公眾得出入之場所，應由成年人伴同，並採取適當防護措施。至於「具攻擊性之寵物」及「其所該採取之防護措施」之規定，則由中央主管機關(即農委會)公告。 又依照農委會於民國 104年09月23日以農牧字第1040043358號公告「具攻擊性寵物及其出入公共場所該採取之防護措施」之相關規定，「具攻擊性之寵物」是指「危險性犬隻」及「無正當理由曾有攻擊人或動物行為紀錄之犬隻」。又「危險性犬隻」是指比特犬、日本土佐犬、紐波利頓犬、阿根廷杜告犬、巴西菲勒犬、獒犬及與上述犬隻混血之犬隻。如將具攻擊性之寵物帶至公共場所，須遵守以下規定：(一)以長度不超過1.5公尺之繩或鍊牽引、(二)配戴不影響散熱之透氣口罩。
本案中，該比特犬飼主小明未依前述規定備妥相關防護措施即出入公共場所或公眾得出入之場所，主管機關得依動保法第29條規定處飼主新臺幣3萬元以上15萬元以下罰鍰。
並且，飼主可能會因違反動保法第7條未履行防止寵物無故侵害他人之義務，主管機關得依動保法第32條第3項第3款，逕行裁處沒入飼主之動物。然而，此部分實務上(參照最高行政法院92年判字第242號判決)認為，飼主因管理不善致犬隻侵害他人，如歸咎於犬隻即處以沒入，形同處以該犬極刑，有悖保護動物本旨，除非個案中犬隻侵害的事實情節重大，主管機關通常不會裁處沒入犬隻。
二、民事賠償責任：民法第184條第1項前段規定「因故意或過失，不法侵害他人之權利者，負損害賠償責任。」、同法第190條第1項前段規定「動物加損害於他人者，由其占有人負損害賠償責任。」飼主小明未依上開動保法等相關規定，在公眾場所對自己的比特犬採取安全防護措施，因而造成小莉的愛犬遭到咬傷，小明未盡動物管理人之注意義務，已構成不作為之侵權行為責任，小莉為此支出醫藥費用10,000元是受有財產上之損害，小明對於小莉財產上之損害(支出醫藥費用)依法應負損害賠償責任。"
"小明與小美是情侶關係，小明為了自己平日上下班的便利，以及假日便於搭載小美一同外出旅遊，於是決定購買一輛全新的休旅車。然而，小明因為曾經發生多次駕車肇事的不良記錄，所以應繳的汽車保險費率甚高，小明為了繳交較為低廉的汽車保險費，乃與小美約定將所購買的汽車借名登記在小美的名下。怎知，半年之後，小明與小美卻因為個性不合而分手，且雙方發生嚴重爭吵以致於無法溝通，小明要求處理車輛登記乙事，小美皆不予理會。請問，小明要如何辦理汽車過戶登記回自己名下？
","汽車為動產，而動產所有權的移轉，只需要「讓與合意」+「交付」即已足，故車商就汽車與小明有讓與合意，並將汽車交付給小明，小明即取得汽車所有權。至於在監理機關辦理過戶，則屬行政管理事項，非汽車所有權移轉之法定要件。故汽車雖登記於小美名下，但小明才是汽車所有權人，因為小明並沒有對汽車所有權的移轉與小美有讓與合意。
本案中，小明為了要降低保費，將汽車借名登記於小美名下，而借名登記契約的性質，實務見解認為(最高法院106年台上字2678號判決)，應類推適用民法「委任」契約之規定。又依民法第549條第1項規定，當事人之任何一方，得隨時終止委任契約。故小明與小美成立汽車借名登記契約，其契約類推適用民法委任之規定，又按照上述民法規定，小明可以隨時終止與小美的借名登記契約。
汽車借名登記契約一經終止，依法即向後失效，小美享有「登記之利益」則屬無法律上之原因，也就是說，汽車先前之所以可以登記在小美名下，是因為有借名登記契約的依據，但該契約如果被終止，則小美的汽車登記就開始無所憑據。因此，小美構成民法第179條之「不當得利」，依法應將該「登記之利益」返還給小明，亦即，將汽車過戶登記為小明名下。
由於監理機關為牌照登記管理機關，汽車之登記僅形式審查，不問實際所有權人，辦理車輛過戶登記應出示雙方車主證明文件，表示他們移轉登記是合意的，若其中一方不同意辦理過戶，則另一方應持有雙方車主協同配合至監理機關辦理過戶之判決確定，監理機關始能認定雙方合意過戶。因此，小明應先終止借名登記契約，再本於其為汽車之所有權人，以訴訟請求小美應協同小明至監理機關辦理汽車借名登記之異動，將汽車過戶登記於小明名下。"
"何謂支付命令？戶籍地在台中的A先生，因積欠銀行債務，遂離開戶籍地避債，未與家人聯繫。期間銀行屢次向A先生催收未果，遂向法院申請支付命令，請求A先生清償卡債，法院依債權人即銀行之請將支付命令寄至A先生之台中戶籍地，由A先生之配偶收受。法院因於支付命令送達後20日內未收到債務人A先生提出異議，法院則發給銀行支付命令確定證明書。事後A先生返回戶籍地始知悉上開情事，主張其未居住在戶籍地，本件支付命令並未合法送達。試問A先生的主張是否有理？
"," 一、何謂「支付命令」？
支付命令規定在民事訴訟法第六編「督促程序」，係指債權人對債務人若請求支付一定數量之金錢、或其他代替物(如白米20公斤)、或有價證券(如某股份有限公司股票50張)，可請求法院對債務人發支付命令，督促債務人在收到支付命令後20日內，向債權人清償並賠償程序費用。支付命令性質屬於非訟事件，並不需要經由法院開庭審理，為較簡易之解決紛爭方式。
若債務人於收到支付命令後20日內未提出異議，法院則會發給債權人支付命令確定證明書，則該支付命令得為執行名義，債權人得以該支付命令向執行法院聲請強制執行債務人之財產，若債務人欲阻止財產被執行，得於執行程序終結前提起債務人異議之訴(強制執行法第14條第2項)或另外提起確認債權不存在之訴並供擔保聲請停止強制執行(民事訴訟法第521條第3項)。
但若是債務人於支付命令送達後20日內有提出異議，則支付命令會失效，法院則會以債權人支付命令之聲請，視為起訴或聲請調解，雙方債權債務關係之爭議則會進入訴訟程序或調解程序。
二、「支付命令」之送達程序是否合法：
非訟事件法第31條規定，民事訴訟法有關送達之規定，於非訟事件準用之。又民事訴訟法第136條規定，向應受送達人即本人為送達時，應在本人之住居所、事務所、營業所、與本人會晤處所或本人就業處所行之，並應由本人親自收受，此時生送達之效力。又應送達處所中之「住所地」應如何認定？依民法第20條規定，住所地之認定須符合以下二要件，分別為「主觀上有久住意思」與「客觀上有住於一定區域事實」，因此，「戶籍地」並非作為認定住所地之唯一標準(最高法院107年台上字第62號判決)。但實務上(最高法院109年台抗字第313號裁定)認為，若無客觀的事證足認當事人已久無居住該原登記戶籍之地域，並已變更意思以其他地域為住所者，戶籍登記之處所，仍非不得作為推定其住所之依據，因此，在A先生能舉反證推翻台中並非其住所地之前，A先生之住所地仍係台中。縱使A先生是出於短暫避債之意思暫時不住台中，仍不改變A先生之住所仍為台中之事實，蓋A先生仍有歸返之意，對於台中無廢止其為住所之意思(最高法院106年台上字第2635號判決)。
又倘若未能於本人之住居所、事務所或營業所會晤應受送達之本人時，依同法第137條規定，只要應受送達人之同居人或受僱人有辨別事理的能力且該等之人亦非應受送達人之他造時，送達人只需將應送達之文書付與應受送達處所之同居人或受僱人，即生合法送達效力。本題中，A先生之配偶為同居人，故A先生之配偶收受支付命令，已生合法送達之效力。A先生之主張並無理由。"
何種案件得向臺中市政府採購申訴審議委員會申請調解？,"一、依政府採購法第85條之1及採購履約爭議調解規則第2條規定，廠商因辦理臺中市政府及所屬機關辦理政府採購案件，與機關因履約爭議未能達成協議者，得向臺中市政府採購申訴審議委員會申請調解。
二、調解申請書相關書表格式，得至「臺中市政府法制局全球資訊網-機關業務-採購申訴及履約爭議-履約爭議調解書表格式」項下下載利用。"
何種案件得向採購申訴審議委員會提出申訴？,"依政府採購法第76條、第85條及第102條規定，廠商對於下列事項，得於法定期間內向採購申訴審議委員會提出申訴：
（一）廠商對於公告金額以上採購異議之處理結果不服，或招標機關逾同法第75條第2項所定期限不為處理者。但爭議屬於同法第31條規定，不予發還或追繳押標金者，不受公告金額以上之限制。
（二）機關依同法第101條所為之通知，經異議後，仍不服異議處理結果。
（三）審議判斷書指明原採購行為違反法令，招標機關未於法定期限內為適法處置，廠商得自期限屆滿之次日起15日內向採購申訴審議委員會申訴。"
申請採購申訴或履約爭議調解是否需繳納費用？收費標準為何？,"一、依政府採購法第80條第4項及第85條之2規定，廠商提出採購申訴、申請履約爭議調解，應繳納審議費、調解費。
二、每一申訴事件審議費為新臺幣3萬元；調解事件之收費標準則以廠商請求或確認之調解標的金額，並依採購履約爭議調解收費辦法第5條所定級距，收取調解費。"
提起採購申訴法定期間及方式為何？,"一、依政府採購法第76條、第102條、採購申訴審議規則第2條及第7條規定，廠商不服機關所為異議處理結果，或機關於法定期限內不為處理者，廠商得於收受異議處理結果或期限屆滿之次日起15日內，依其屬中央機關或地方機關辦理之採購，以書面分別向主管機關、直轄市或縣（市）政府所設之採購申訴審議委員會申訴。廠商提出申訴，應同時繕具副本送招標機關。
二、依採購申訴審議規則第3條規定，申訴應具申訴書，載明下列事項，由申訴廠商簽名或蓋章︰（一）申訴廠商之名稱、地址、電話及負責人之姓名、性別、出生年月日、住所或居所。（二）原受理異議之機關。（三）申訴之事實及理由。（四）證據。（五）申訴之年、月、日。
三、申訴書相關書表格式，得至「臺中市政府法制局全球資訊網-機關業務-採購申訴及履約爭議-採購申訴書表格式」項下下載利用。"
